{
  "schema_version": "1.0.0",
  "record_id": "fictional-call-2026-release-a",
  "created_at": "2026-07-20T00:00:00Z",
  "baseline_fingerprint": {
    "rubric_version": "fictional-commercial-rubric-1.0.0",
    "policy_context": "fictional-call-2026",
    "resolved_config_sha256": "sha256:0000000000000000000000000000000000000000000000000000000000000001",
    "prompt_bundle_sha256": "sha256:0000000000000000000000000000000000000000000000000000000000000002",
    "tool_schema_sha256": "sha256:0000000000000000000000000000000000000000000000000000000000000003",
    "few_shot_set_sha256": "sha256:0000000000000000000000000000000000000000000000000000000000000004",
    "model_identity": "fictional-model-2026-06",
    "evidence_cutoff": "2026-06-30T23:59:59Z",
    "pipeline_commit": "0000000000000000000000000000000000000001",
    "executed_at": "2026-07-01T08:00:00Z"
  },
  "candidate_fingerprint": {
    "rubric_version": "fictional-commercial-rubric-1.1.0",
    "policy_context": "fictional-call-2026",
    "resolved_config_sha256": "sha256:0000000000000000000000000000000000000000000000000000000000000011",
    "prompt_bundle_sha256": "sha256:0000000000000000000000000000000000000000000000000000000000000012",
    "tool_schema_sha256": "sha256:0000000000000000000000000000000000000000000000000000000000000013",
    "few_shot_set_sha256": "sha256:0000000000000000000000000000000000000000000000000000000000000014",
    "model_identity": "fictional-model-2026-07",
    "evidence_cutoff": "2026-07-19T23:59:59Z",
    "pipeline_commit": "0000000000000000000000000000000000000011",
    "executed_at": "2026-07-20T08:00:00Z"
  },
  "change": {
    "reason": "Fictional clarification of evidence recency and scope definitions.",
    "changed_fields": [
      {
        "field": "rubric_version",
        "old_value": "fictional-commercial-rubric-1.0.0",
        "new_value": "fictional-commercial-rubric-1.1.0"
      },
      {
        "field": "model_identity",
        "old_value": "fictional-model-2026-06",
        "new_value": "fictional-model-2026-07"
      }
    ],
    "affected_criteria": ["market", "traction"],
    "affected_applicant_groups": ["fictional-early-stage-companies"],
    "human_change_owner": "programme-review-lead"
  },
  "calibration": {
    "case_basis": "fictional",
    "case_count": 24,
    "reviewer_count": 2,
    "blind_independent_labels": true,
    "label_distribution": {
      "reviewer_a": { "supported": 4, "partial": 4, "missing": 4, "conflicting": 4, "stale": 4, "not_applicable": 4 },
      "reviewer_b": { "supported": 4, "partial": 4, "missing": 4, "conflicting": 4, "stale": 4, "not_applicable": 4 }
    },
    "raw_agreement": 0.5,
    "cohens_kappa_unweighted": 0.4,
    "material_disagreements": 12,
    "unresolved_material_disagreements": 0
  },
  "disagreement_agenda": [
    {
      "case_id": "fictional-case-07",
      "criterion_id": "traction",
      "evidence_locator": "fictional-case-07#metric-window",
      "reviewer_a_state": "partial",
      "reviewer_b_state": "stale",
      "candidate_state": "partial",
      "disagreement_type": "time_boundary",
      "policy_question": "Which fictional observation window applies?",
      "accountable_owner": "programme-review-lead",
      "human_outcome": "Keep candidate as a separate variant during a bounded pilot.",
      "decided_at": "2026-07-20T09:00:00Z",
      "applies_from": "2026-07-21T00:00:00Z"
    }
  ],
  "historical_outcome_use": "retrospective_separation",
  "decision": {
    "comparability": "separate_variant",
    "release_status": "bounded_pilot",
    "human_owner": "programme-review-lead",
    "programme_policy_owner": "programme-policy-owner",
    "eligibility_owner": "eligibility-review-owner",
    "final_funding_decision_owner": "funding-panel-chair",
    "decided_at": "2026-07-20T09:15:00Z",
    "decision_note": "Fictional bounded pilot; do not mix candidate and baseline results."
  }
}

